{
  "$schema": "https://json-schema.org/draft/2020-12/schema",
  "$id": "https://agentiad.local/baseline_run_definition.schema.json",
  "title": "AgentIADBaselineRunDefinition",
  "type": "object",
  "additionalProperties": false,
  "required": [
    "run_id",
    "mode",
    "prompt_version",
    "parser_version",
    "execution_boundary",
    "sample_source",
    "backend",
    "seeds",
    "artifacts",
    "remote_expectations"
  ],
  "properties": {
    "run_id": {
      "type": "string",
      "minLength": 1
    },
    "mode": {
      "type": "string",
      "const": "no_tools"
    },
    "prompt_version": {
      "type": "string",
      "minLength": 1
    },
    "parser_version": {
      "type": "string",
      "minLength": 1
    },
    "execution_boundary": {
      "type": "string",
      "enum": ["local", "remote"]
    },
    "sample_source": {
      "type": "object",
      "additionalProperties": false,
      "required": ["kind", "path", "source_name", "splits", "max_samples"],
      "properties": {
        "kind": {
          "type": "string",
          "enum": ["fixture", "real"]
        },
        "path": {
          "type": "string",
          "minLength": 1
        },
        "source_name": {
          "type": "string",
          "minLength": 1
        },
        "splits": {
          "type": "array",
          "items": {
            "type": "string",
            "enum": ["train", "val", "test"]
          },
          "minItems": 1
        },
        "max_samples": {
          "type": ["integer", "null"],
          "minimum": 1
        }
      }
    },
    "backend": {
      "type": "object",
      "additionalProperties": false,
      "required": ["type", "name", "policy", "runtime_owner"],
      "properties": {
        "type": {
          "type": "string",
          "enum": ["mock", "vllm", "transformers"]
        },
        "name": {
          "type": "string",
          "minLength": 1
        },
        "policy": {
          "type": "string",
          "minLength": 1
        },
        "runtime_owner": {
          "type": "string",
          "minLength": 1
        }
      }
    },
    "runtime": {
      "$ref": "#/$defs/runtimeConfig"
    },
    "seeds": {
      "type": "array",
      "items": {
        "type": "integer"
      },
      "minItems": 1,
      "uniqueItems": true
    },
    "artifacts": {
      "type": "object",
      "additionalProperties": false,
      "required": ["root", "raw_outputs", "traces", "predictions", "metrics"],
      "properties": {
        "root": { "type": "string", "minLength": 1 },
        "raw_outputs": { "type": "string", "minLength": 1 },
        "traces": { "type": "string", "minLength": 1 },
        "predictions": { "type": "string", "minLength": 1 },
        "metrics": { "type": "string", "minLength": 1 }
      }
    },
    "remote_expectations": {
      "type": "array",
      "items": {
        "type": "string"
      }
    },
    "notes": {
      "type": "array",
      "items": {
        "type": "string"
      }
    }
  },
  "$defs": {
    "runtimeConfig": {
      "type": "object",
      "additionalProperties": false,
      "properties": {
        "base_model_path": {
          "type": ["string", "null"],
          "minLength": 1
        },
        "adapter_checkpoint_path": {
          "type": ["string", "null"],
          "minLength": 1
        },
        "checkpoint_step": {
          "type": ["integer", "null"],
          "minimum": 0
        },
        "checkpoint_run_dir": {
          "type": ["string", "null"],
          "minLength": 1
        },
        "local_files_only": {
          "type": "boolean"
        },
        "trust_remote_code": {
          "type": "boolean"
        },
        "dtype": {
          "type": "string",
          "minLength": 1
        },
        "device": {
          "type": "string",
          "minLength": 1
        },
        "tool_first_intervention_strategy": {
          "type": "string",
          "enum": ["baseline", "tool_first_nudge", "tool_first_strict"]
        },
        "first_turn_protocol_gate_mode": {
          "type": "string",
          "enum": ["off", "retry_once_pz_cr"]
        },
        "generation": {
          "type": "object",
          "additionalProperties": false,
          "properties": {
            "max_new_tokens": {
              "type": "integer",
              "minimum": 1
            },
            "do_sample": {
              "type": "boolean"
            },
            "temperature": {
              "type": "number",
              "minimum": 0
            },
            "top_p": {
              "type": "number",
              "minimum": 0,
              "maximum": 1
            }
          }
        }
      }
    }
  }
}
